file_name,transcription
data/train/811.wav,a N su tsoo khah oh tshue tshue tshut lai e u e khuann khi lai tsiann bian kiong
data/train/812.wav,soh a thai e bo tng
data/train/813.wav,beh pue ong hiong kang e pan ki ting ki beh suah ah tshiann lu kheh tiunn a hue kah li a tsui kin lai ting ki
data/train/814.wav,su su long ai ua kho lang
data/train/815.wav,in ui lan e gi su tah phue tsho ngoo tsho ngoo kho ling pau kuah gi huat kah kuan iong gi
data/train/816.wav,pian tong sui lian i king ling khi ah tan si mui tsit tshui long kam siu e tioh sio kun kun e ai
data/train/817.wav,ueh peh sann huan ah li tui to ui lai e gua tsit e kah li tui bak to kam kak tsiok tshi tshak tioh kak hue a kong tioh ue si tsit khuan tsiok tshau hue tsiok bo se ji e khui khau
data/train/818.wav,tse kha me lah si canon e tsiann kui
data/train/819.wav,m thang kuann tioh
data/train/82.wav,sin the bo tianne siunn beh ai e mih
data/train/820.wav,kiu lang ooh aih ioh i bo huat too lah
data/train/821.wav,khah tsa lin goo si kui som som e kue tsi
data/train/822.wav,hngh ah tsit e mng bo suah ka kuainn leh m tu ho ka lin pe long lip lai
data/train/823.wav,mui tsit pue long u he tok
data/train/825.wav,thau ke bin a tsai li koh e lai honnh u lang be jim leh an ne leh mng han tsing li
data/train/827.wav,tsit nia sann e tiong tsua thinn tshit liap kim sik e liu a siam siam sih sih tsiok siann lang bok e e kun siu nng tsiah peh thoo a tsiok koo tsui e
data/train/828.wav,kok ui ping iu na u siann mih soo tsai su iau gua tau sann kang tshiann sui ka gua kong gua tsin liong lai tshu li
data/train/829.wav,sit le honnh hoo li tan tsin ku li leh siu khi si m？
data/train/83.wav,i khuann tian si bo
data/train/832.wav,na tsiah na khuann a kong khat tsit khat mi hun koo hian tsian tso mi phue
data/train/833.wav,li ho
data/train/834.wav,li lo kue i
data/train/835.wav,gua i king hun e tshuai hong hiong
data/train/836.wav,liat tshia tih beh tsin tsam a tshiann li khui gueh tai pinn a khah be gui hiam
data/train/837.wav,m kam boo tioh gam siu tsiat bua ang tshua boo thiau hai kiann te loo
data/train/839.wav,thau ke ma huan mi hun kin puann
data/train/84.wav,bo gua kio i sin sua uat kue lai tsai li
data/train/841.wav,u tai tsi to ka gua Line gua na khuann tioh e sui hue li
data/train/842.wav,se iunn e kui a tseh tak ke tang tse kue
data/train/843.wav,pun koo niu
data/train/845.wav,thinn khi ling ah li e bin ai buah tsit kua khu li mu bin tsiah be pit pit
data/train/846.wav,Stephens ma m si uan tsuan leh the Obama pian hoo i jin ui tui Obama e phue phing lai te
data/train/847.wav,tshiann lin tak ke khah siok tsing leh
data/train/848.wav,tsit ma beh jip tsam e si ta lu kuh ho m si tsit pang tshia e lu kheh m thang tsiunn tshia tsiah be hoo lang ke huat goo tsap pha e tshia tsinn
data/train/85.wav,ui tioh tsuann iunn leh ui tioh tsuann iunn leh ui tioh tsuann iunn leh beh lai tui lan tsoo gai
data/train/850.wav,tsuan kok tsap ik thong tsang e tshiu a long tsho liau liau
data/train/851.wav,tshua li tshut lai khuann tian iann m si beh phah kau eh lah
data/train/853.wav,li na beh khi be mih kiann tsit hu kin u tsit king Costco mih kiann siok koh tua uann lai te ma tsiok khuah tsiok ho seh e
data/train/854.wav,tse lan tshu lai e tsong hong si iong hi noo khih e khah m kiann e khi hoo thang tsiu khi soo i siong bo tong it ji tsap ni to bo bun te lah
data/train/855.wav,siong lan tit e si i tsit si a to be hiau pai tui lang tsiann u le mau soo i han tsing li tsiann thiann tsit e too te
data/train/856.wav,li it ting ai khah tsin tsok leh
data/train/857.wav,tsong sng u tsit kang kiong lok sia tsun pi beh phah tai uan thau tsit tshut tsiann kang e tai gi tian iann ong po tshuan i sih ping kui
data/train/858.wav,i lang leh bo ing kong phua hit te po le
data/train/86.wav,ma be in ui ke tshut lai e goo kong kin the tang m kann tshut mng
data/train/860.wav,na hui hing ki put tik i loh pue ti hai ting tshiann tak ke ai tshing kiu sing i kiu sing i ti i a kha sing tshing jip khi tsiah ka liu khi lai siong bue iong tshui pun hong pun hoo pa pun kah phong khi lai to e sai
data/train/861.wav,tsiah pa liau au tak ke tng lai tsiu tiam hioh khun
data/train/862.wav,li mng bo sing khui lun i sak be tshut lai
data/train/863.wav,tshue si ah hannh
data/train/864.wav,suann bing tsui pho tshio bun bun
data/train/865.wav,li sing ka mng khui khui lun i m tsiah sak e tshut lai kheh thiann
data/train/866.wav,kuan thai lang tshui tshiu beh lau tiam to tsit ping
data/train/867.wav,ah piau sio ti piau sio ti ah
data/train/868.wav,kim lai kong tsing ue
data/train/869.wav,tai tsi ai ka mng mng leh
data/train/87.wav,ho long tshuan ho king ti long tshuan koo niu tann tsui tshio hi hi
data/train/871.wav,ong ko a li khuann hue thoo a kah siu lan in hiah ni siong ho li tsit e lang na gong lang leh long bo kam tsing
data/train/872.wav,suah ti ki thann soo tsai siunn kue se li
data/train/873.wav,tsit hang tshai tsin loh png
data/train/874.wav,Caryl in iong hak tsia Paul Stares e kong huat hian tsai mui the e tsuan kiu hua
data/train/875.wav,li na e hiah kheh khi nooh
data/train/876.wav,tse si Hillary Clinton in ang Bill Clinton tso tsong thong e si tshiam su e
data/train/877.wav,io ooh io io io
data/train/878.wav,iah a be pi tsiau a pue khah hng
data/train/879.wav,kang khuan bian sio tshiunn
data/train/880.wav,li na beh koo ui tng hoo ui tng khah ho leh ai e ki tsit tak kang tsiah ua kha moo tooh
data/train/882.wav,thinn khi pian luah tsiok tse tsa poo lang leh tshing lai lin gu
data/train/883.wav,kuann thinn e tsui ling ling ling
data/train/884.wav,tsai ia e kang tong lai te u kau siann kau e gi guan long tsi tshi tong sing hun
data/train/885.wav,m koh i iong ui hik e hong sik tsi iau se hong u piau hian tshut jim ho jiok tiam
data/train/886.wav,tse tseh
data/train/887.wav,bo tsiah pai thok li honnh
data/train/888.wav,kiann u siang tsau lai thau theh gua e tsinn pau a
data/train/889.wav,jit loh se san e si li kam e tang bo ui bo ham an sim jip bang
data/train/89.wav,am tng lan lai tsiah pizza ho bo
data/train/890.wav,lin boo kam tsai iann li tioh ai kok tsiong kuan
data/train/891.wav,a pah
data/train/892.wav,he tsui ko gua khau koo senn hiah ni tng honnh bai khun tsiok tse m ho koh tsiah ah ai tan tiau
data/train/893.wav,li m kann ah nih
data/train/894.wav,eh mh
data/train/895.wav,iunn a kam e khi tsiah hit e sik ti ho khuann m koh tui sin the u sun hai e hue
data/train/897.wav,pi tsit e le
data/train/898.wav,ah si an tsuann pat lang e tang khuann bian tsinn e gun be ing tsit lah
data/train/899.wav,hit e lang khian thian khian thian siunn beh nia tsiong kim
data/train/9.wav,tak ke long kau e si lan tsiah tang tse tshut hai kuan nia hing li
data/train/90.wav,to tsit tiau loo si tioh e
data/train/900.wav,i hit tai tshia tsue kin ai lai uann thai ia
data/train/901.wav,jit thau loh hai
data/train/902.wav,ti tsap peh ho tshin suai soo huan tsin iau hio gueh sin ting phik lik tsha ang a bing tshenn ti hun lim kuan hoo bue poo te hi kuan khai ian
data/train/903.wav,he siann mih
data/train/904.wav,sio jin hi tsit ma kau tshiu na lai lom thoo e soo tsai hia e tiong ng u tsit tong tshu he si iong ping tsun im si e lang kut thau soo khi e
data/train/905.wav,gua beh kau B si pang gua jih tsit e
data/train/907.wav,li mi tsu kah sio sio sio
data/train/908.wav,tse leh
data/train/909.wav,lan kam tioh koh huan lo au pai i e bo iau bo i to tsho tshiu a thiah lik su kian tiok
data/train/91.wav,tsiok tsiok hoo i than sann pah ban
data/train/910.wav,lan tak ke tshut lai tshit tho ke kiam be kua tan loo tng khi pun tshin tsiann goo tsap kah ping iu tso hue pun tiunn tan leh tshua tak ke khi seh tsit kua tai uan u mia e ong lai soo lik tau phong
data/train/911.wav,te lak pah peh tsap si phinn a put lah e sann e tsa boo lang
data/train/912.wav,kue too siau hui e hio ko to si hoo te kiu pian tso tsit e pun so thang
data/train/914.wav,lang kong bian tsinn e siong kui tse ti hian tshu si e bang loo se kai lai kong tsin u to li tshiunn Facebook Google tsia e kok tsiong e bang loo hok bu hoo lan iong bian tsinn e ki sit in si beh siu tsip lan e tsu liau tsiang ak lan e hing ui tse to si lan ai hu tshut e tai ke
data/train/915.wav,piau gi kah hian sit uan tsuan tui huan tsin tse lang luan tan pun so e soo tsai tsiah e u kim tsi luan tan e piau gi
data/train/916.wav,ah u iann li ting pang kong hit e ping iu beh lai tsiah thau loo kam iau bo siann siau sit
data/train/917.wav,oh lang an tsuann ka tiu a kuah loh lai
data/train/918.wav,a ni khih li an ne kong tsin u lan tsa poo lang e khui khau neh
data/train/919.wav,ooh hue thoo li pun tsit te kua hoo gua thiann tso lan li piat e ki liam ho m
data/train/92.wav,tse jiak kuh tioh ai iong bo kang khuan e mi sin lai tshia
data/train/920.wav,tsit kin bah khi kau si pah khong e tsiah e ti kue ni be bah
data/train/922.wav,tshi sat bak a siong thau sing ai tsu i siann
data/train/923.wav,bing tsai li si khin poh bo tsing
data/train/924.wav,han ban han ban lah
data/train/926.wav,lan be mih kiann tsin tsing tioh sing khuann sam phu luh khuann mai khuann u kah i bo
data/train/927.wav,in ui tsu liau liong tsiann tua tsit pai sit giam kan tann tshue a N hing iong su──mia su V N tong su──mia su su tsoo
data/train/928.wav,siann siann ku ku long si khi phian gua
data/train/929.wav,sio koo niu ban pin nng tsit e ban tsit e tsng mui jit tan thai bang tiong jin
data/train/93.wav,kam u sau tang si e sau
data/train/930.wav,tak liap long sui
data/train/931.wav,siau lian lang li si tsin han tit khuann tioh e ho lang li kam guan i tso gua e too te han tsing li an ne mng siau lian ke
data/train/932.wav,oo hau lau su
data/train/933.wav,gun be tsiah ni tse mih kiann thau ke li ma sa bi su tsit e sng khah sioh leh
data/train/934.wav,tsin sit le gua kam moo a tit tit lau phinn lang kui kang long bo sann song khuai kan na koh huat sio
data/train/935.wav,o tsiu kong poo kong si ABC e tsit phinn hun sik bun tsiong kong na si e tang koh tshiau tshut tsit e khua tong phai e te si an mai tsit tong tsit an kai kik e khah u iann bin
data/train/936.wav,u kho ling kue kui tang au gin a to be lin tit hue lian tau te senn siann khuan
data/train/937.wav,ki sit u kai tse khuan sann long iong nai long tso e
data/train/938.wav,aih ioh ooh li bak tsiu thoo lui si m
data/train/939.wav,Islam kau Sunni phai e Saudi kah Shia phai e Iran si tik tui e khu hik kiong khuan
data/train/94.wav,gua ai khi ah bian m bian hiooh
data/train/940.wav,bi kok lang kam kak tshiunn siong an tsuann tshu li ah si siu tsip in e tsu sin in bo huat too khong tse tsi u iu tsai in khi
data/train/941.wav,penn inn koh khiam it ji tsap ban lip e hueh
data/train/942.wav,an tsuann ah hannh
data/train/943.wav,sim kenn that teh huat tsok e si u tsit puann e in khi sim lut put tsing bo tiunn ti si
data/train/944.wav,pio si tsha sun V tsih
data/train/945.wav,a tsai m a a tsai peh si khi e si tsun ka gua tsioh sann ban khoo gua hian si tsin khun lan
data/train/947.wav,ui tsit tiunn too bin ting honnh lan lai khuann tsia
data/train/948.wav,a hong lang lau sit lau sit
data/train/95.wav,mih kiann guan lai ti tsia gua sit tsai si tua bak sin niu bo khuann eh tsau
data/train/950.wav,bo se ji hoo a bok a khuann tioh e
data/train/951.wav,pi lun kong Iraq ban it kau si tsun hoo IS kah Shiite e Iran pun phenn tui bi kok e bing iu kah tng ki li ik long e king ka gui hiam
data/train/953.wav,li kam u kam kak jin sing khang kue
data/train/954.wav,ai tsu i e si u si a na phah ji tsho ngoo in ui tsho ji e su pin tsin ke e ti su mi kah CR e hun soo pian tsiok kuan
data/train/955.wav,tsit tiau loo tit tit tit
data/train/956.wav,o a pi le a khah kui
data/train/958.wav,ma mah kin a jit si li e senn jit gua lai ka li tau se uann
data/train/959.wav,ue thau tsok tsia ka thok tsia tsu kun po ko
data/train/96.wav,a bu kin a jit si bu tshin tseh tsu png to hoo gua lai tau sann kang
data/train/960.wav,leh huah ah u thiann tioh honnh
data/train/964.wav,guan tian nau si tau Office Word ji khong it khong u thang khiam tso ODT tong
data/train/965.wav,gua ia m si siang khuan
data/train/966.wav,lau sing hian
data/train/967.wav,han tsing li ka hit tsit kua lang kong gua tsu e inn a kam tsiann sit hiah ho tsiah si bo lin tsai iann tsai liau si ui to ui lai e bo
data/train/968.wav,mh
data/train/969.wav,te ji e si siong kuan too correlation i ha kan tshing CR tse ma si tsit e thong ke e kong sik
data/train/97.wav,tsioh gua khuann tsit e honnh
data/train/971.wav,tsiah ni am ah iau bue khun
data/train/972.wav,sing tshiann i tshut khi
data/train/973.wav,sui lian u phah tsiat m koh sng sng leh kin pun siok bo gua tse
data/train/975.wav,soo i phau gu ling beh hoo gua phe phang e lah
data/train/977.wav,kin ki gi liau khoo beh ka kiong tong tshut hian ji tshiann kuan he bit tshiat e gi su tshue tshut lai si li iong thong ke e hong huat
data/train/978.wav,an tsuann gun tsa boo kiann u gau bo
data/train/979.wav,hit king gin hang u sak JCB e khah kong siann mih iong JCB to hoo li sa bi su
data/train/98.wav,siong ho si put si tsiong kha poo thing loh lai tsiong sim tsing loh lai hoo ka ti bo khang khue ho tso
data/train/980.wav,gua sann tsap ji Giga e sui sin tiap phang kinn ah
data/train/981.wav,phue ka gua kheh khi khuann lah lang gua tok sin lah
data/train/982.wav,m thang oo peh tan pun so tsui tshim gui hiam kim tsi sng tsui si si hong hue ni ni ping an
data/train/983.wav,in ui kin ni liong tsio phenn oo e phah be tshi tiunn tak ke sio tsenn be thoo thuh hi
data/train/984.wav,sip pat a
data/train/986.wav,tsit e sia hue i kai kuan sim
data/train/987.wav,ke tsit uann bi ko tshut lai
data/train/988.wav,kiann lai khi gua khau na tsiah na kong
data/train/989.wav,khu e tshiunn e R and B u kau ho thiann
data/train/99.wav,tse to si li tue i be tioh e soo tsai
data/train/990.wav,tong lian lan e sai siu tsing thong ke hong sik ka bo sio ua m koh li bo gua hng e gi su ma kho lu jip lai ah si siu kai kong sik lai ke sng sann e gi su e hoo siong kuan he
data/train/991.wav,kok ui su hiann su tse lan tsit ma tiam tsia hioh khun tsit e gua khi pan li ting ki e tshiu siok puann tiam tsing au lai tsia sio tan
data/train/993.wav,gua e iPad it tit thiau tshut iOS beh king sin e thong ti
data/train/994.wav,ah lai lai lai
data/train/995.wav,khia Gogoro tian tong tshia ma bo khah tiam m koh m bian ka iu tsi si put si ai khi uann bat te lih
data/train/996.wav,gi liau khoo to si khng gi gian tsai liau e tshng khoo i e sai kong si jin lui soo kong soo sia e gi gian bun ji e tsit e iunn pun
data/train/997.wav,hui lu muh teh phak teh se
data/train/999.wav,bin a tsai morning call si tshit tiam tsa tng ti ji lau tiong tshan thiann tsa tng e si kan si lak tiam kau tsap tiam
data/valid/100.wav,tsit khann sir tian le su e tiann si siang the e oo
data/valid/1005.wav,a tat a i king bo ai lang ah
data/valid/101.wav,be e pi be e ke tsit puann
data/valid/1010.wav,bian li ke po
data/valid/1021.wav,koo tshi khi kau nng sann pah ban tiam e khuan
data/valid/1024.wav,kin a jit tshu lai bo lang kheh
data/valid/1027.wav,bah na tsu sik honnh phang lai khi hoo in an ne i su to bo kang khuan ah neh
data/valid/1032.wav,te tshit pah khong si phinn ko hiong huat e bue pang tshia tshui tshui ah kiu lang ooh tshui tshui ah
data/valid/1033.wav,peh ue ji e li ik lau boo tshing tu it pat pat liok
data/valid/1040.wav,ka su lan beh tsai iann tsit e mia su thau tsing e sai iong siann me tong su to ping tah phue ah si tsit e tong su au piah e sai iong siann me mia su tsiann ping tah phue iong mi ah si CR lai tsha sun tsha tshut lai e kiat ko tsin u tsham kho ke tat
data/valid/1052.wav,tang a
data/valid/107.wav,kau tsian e siau sit tai lam hu siann kau hue po pian tsip sik tu it kiu khong ngoo
data/valid/1076.wav,long tsu tiunn kiong nge gua kau tsing tshik
data/valid/109.wav,ban ban m thang khi
data/valid/1090.wav,a iong a o lo gua kha tshiu me
data/valid/1096.wav,pun bun the tshut li iong su lui e sin sit lai tsin hing thai suan e hong huat tsu tong ka bo pit iau e tsu liau theh tiau the sing tsu tong tai gi gi su tah phue e phin tsit pang tsan tai gi gi su e hak sip
data/valid/1108.wav,li tso li tsau
data/valid/1113.wav,Myanmar tsing hu pik hai sin Islam kau e Rohingya lang
data/valid/1115.wav,mai khi lah heh
data/valid/1116.wav,D kai tsin tng su he thong li iong BMM ian suan huat kiat ko tso hun lian tsu liau ting tso tui u tsi tsio nng tsiong tng huat e bun ku iong thong ke hong huat the kuan tsing khak lut iau koh u tsuan iu mia su ting liong su ai tshu li
data/valid/1130.wav,tsau lah
data/valid/1144.wav,bo iann lah li tshiunn tioh koh khah ho thiann
data/valid/1145.wav,na si tu tioh tik su e tsong hong ki tiunn e ka sang soo phah khui sang soo am e ui bin ting lak loh lai tshiann ka sang soo am kua hoo ho
data/valid/1152.wav,khi PC home be pit tian kam u pi khi tiam lai be khah kin
data/valid/1158.wav,li m tsai iann hit e tsa boo gin a e ko sing an ne liok it ting e au tsuh e
data/valid/1160.wav,tsu lai tai gi ian guan bo te ui tioh tsng siau thiu a be tsio ge mia si iong phainn i su e ue lai ho tshiunn thuat suann to si
data/valid/1167.wav,lan ting hue tshia tuann koh khi tshia thau hu tsinn theh tioh tshia tuann lan e sai kong tshia tuann phah ho ah
data/valid/1171.wav,gua ka kai sueh hit hang tai tsi
data/valid/1183.wav,tsu se han tua lang to an ne ka si lan
data/valid/1185.wav,lai khi be mih kiann tsin tsing siong ho si sing lai khuann tsit e a kha ta lok guh
data/valid/1186.wav,hngh hngh
data/valid/1198.wav,kok hue i ting ti ni te tsin tsing tau phio kuat ting
data/valid/1204.wav,i tui tsit e sia hue kai kuan sim
data/valid/1207.wav,toh ting e ti tshun kui kha
data/valid/1209.wav,tsit ui sio tsia sui kue jim ho lang
data/valid/1211.wav,gua tsi si tue li teh khuann tsa boo gin a uat thau kue lai iong tsit e thian tsin koh long ban e tshio iong ka in ma m tsai iann li ui siann mih ti hia leh thoo tua khui
data/valid/1213.wav,gua the tshinn li ai thak tsheh
data/valid/1214.wav,thih ting a ting uai khi ah li tioh ai giah ba luh lai ka kiau hoo khui
data/valid/1215.wav,tui tsia e bing pang lai kong i king tsin oh sin iong a tsit ui siu hong e Saudi hak tsia kong
data/valid/1221.wav,khun bong khun mai ham bin bian siau siunn a lah。
data/valid/1222.wav,tak ke mng bo tap an ma bo koh ke siok tui mng loh khi ma kang khuan tua tshui a tua tshui leh tsiah ka ti uann lai e inn a
data/valid/1232.wav,ngih buh ngih ngiauh thiann long bo
data/valid/1234.wav,ti a tshi kau puann ni to e thai tiau
data/valid/1242.wav,nng e gi su beh an tsuann tau tin su iong it puann e su tian ping bo tik piat ka tsu bing tse tui gi gian e hak sip ke kiam u tsoo gai
data/valid/1247.wav,li khai si me jit huan lo si ke tsau tsong siunn tsin pan huat tsau tshue hit e
data/valid/1249.wav,tsa me gun kiann sai tsu kah phainn tsiah kah
data/valid/1250.wav,tsiah pueh phenn tua e sio tho pang tsi u kan tan e kui hang ka ku
data/valid/1251.wav,sing kong e su giap hu lu e sing uah
data/valid/1253.wav,gua si sia C e li leh
data/valid/1254.wav,hoo li khiam hiah ni ku ah iau koh tit tit an
data/valid/126.wav,kuann kin ka hing li kia kia tng khi
data/valid/1261.wav,m ho ho a phah piann than tsinn i au nai tue lang e tioh
data/valid/1266.wav,gun ma kio gua khi be tshai
data/valid/1269.wav,pha tsin koo tsit tsun ti tai uan khah bo liu hing a
data/valid/1276.wav,ah m tshun tsit kiu a
data/valid/1289.wav,hu kin e kang tshiunn long e ti sann kinn puann me thau thau a pai lah sap tsui soo i tsue kin kau a tsui long lo lo tak ke tsi ho be RO tsui lai lim
data/valid/1292.wav,tsit tui lau tiang siu ang a boo khan tshiu kui si lang tso hue siu hoo tsit tuann tin kui e ai tsing
data/valid/1294.wav,gueh niu kng iann iann tshat a thau oo piah
data/valid/130.wav,tse ia ai he ia ai
data/valid/1313.wav,si ka li tong tso hiann ti tsiah kong e tsit pit sing li li tshian ban m thang ka pat lang kong
data/valid/1319.wav,a hian kui hue kong ue e khui khau be su tua thau ke
data/valid/1333.wav,ah to gun pa pah m hoo gua tshut lai
data/valid/1339.wav,i tshut hit e ke siau phah phainn hang tsing
data/valid/134.wav,eh a lim peh a
data/valid/1342.wav,ha kho liau au lau su kio gua khi pan kong sik
data/valid/1343.wav,li na honn ki oo suan thau e tso huat ki sit he ah bo siannh suan thau peh peh hoo khui phak hoo ta to uan sing a
data/valid/1346.wav,thoo la khuh sai kue khi liau au oo ian thun pue si ke khong khi u kau bai
data/valid/1355.wav,u iann honnh
data/valid/1356.wav,tsit ki BB call i king pian tso koo tong bo lang beh tih ah
data/valid/136.wav,uat ke tsit ping lah
data/valid/1361.wav,pi lun kong oo tsit khau tsenn e si kan kiam tsio tsit puann
data/valid/1367.wav,ah beh si ah
data/valid/1370.wav,tit tit piann me kang beh hoo tsit tin lang tsong thiam si tsiah kam guan nih
data/valid/1375.wav,u ai gua to ho
data/valid/1376.wav,tai tsiong un su khah phoo phian liau au tha khu sih to bo siann lang tse a
data/valid/1378.wav,lan e bang tsam si ah li kiann SSH jip khi tsu ki liah lau ho bo
data/valid/1380.wav,tsiah pho hoo ho pho hoo ho
data/valid/1390.wav,bo lun lu ho li gua ing kai phe hap tioh si tai
data/valid/1393.wav,tsit ang tsiu lan e tioh bo
data/valid/1400.wav,u nng e kong sik e sai tso
data/valid/1402.wav,lin e mng khui khui khui khui si tshut siann tai tsi
data/valid/1409.wav,bo tiann u tsit kang kok lai e put buan e koh ka bok piau ui kok gua tsuan to tng lai Putin sin siong
data/valid/1410.wav,an ne gua bian kiong tsu iu tsu tsai lai siau iau
data/valid/1420.wav,lan lai khi tam tsui tsiah a geh
data/valid/1423.wav,ho nooh
data/valid/1440.wav,tsit ki kiam bua kah lai siam siam
data/valid/1444.wav,thau kue tsiong tsiong e to kok lian bing lai huat hui bi kok e ing hiong lik
data/valid/1459.wav,pun sit giam sui lian u tsit kua sing ko tsong si tat tit phah piann e soo tsai iau koh tsiann tse pau kuah
data/valid/1462.wav,tsai hue
data/valid/1469.wav,u tsing lang hing iann put li
data/valid/1471.wav,iau u tse tse sio se e kau hue ti tsit e bun te teh hinnh hinnh tshan
data/valid/1480.wav,tua siann lai kio i gua e lang ah siann im hiang liang mua suann pinn
data/valid/1481.wav,ui tioh be kong ko bin tsheh e khong tse siann mih tshut hian ti lan e tsu iah siann mih be
data/valid/1486.wav,ji tsap kau tsu lang kah loo le
data/valid/1487.wav,tsit ma ah tioh kue ni tsiah u bah thang ho tsiah
data/valid/1494.wav,loh hoo thinn honnh loo kut kut he han too luh tioh ai liah hoo an
data/valid/1508.wav,sann tsap kau ka siat ku ka siat ku si hok hap ku e tsit tsiong i si iu nng e kan tan e ku tsoo sing──
data/valid/1512.wav,aih ioh
data/valid/1515.wav,u gua u siunn tioh
data/valid/1525.wav,Adidas tsit kui ni ma oh Nike siat ke tsit kua sik tsui kiau e e a
data/valid/1544.wav,na e kau tsit tsun iau bue pue tng lai lah
data/valid/1548.wav,ping tshiann piau si tse si tsit e kok ka e te it pai
data/valid/1562.wav,lan lai khi sa kha li bah tsiah o a tsian kah kuann tsha pang
data/valid/1569.wav,tsit hue to e kue to be kue ah
data/valid/157.wav,in tshiu e ke tian kong ti siann mng e mng sinn luan sia luan uih
data/valid/1571.wav,i hoo phing lun tsia sia kong lo ma thian tsu kau ting tsit ma si it liap it e tsu pun tsu gi phue phuann tsia
data/valid/1579.wav,se hoo tshing khi
data/valid/1580.wav,i m bat lai kue han kok
data/valid/1581.wav,heh heh
data/valid/1587.wav,ji tsap it tso bo khang khue tsue kin u ing bo kang khuan tsin bo ing neh tak ke tak jit phah piann
data/valid/1589.wav,heh si gin a
data/valid/1594.wav,tong but po hoo huat kui ting kim tsi su iong liah siu ngeh
data/valid/1598.wav,tse tai uan thau tsit tshut se kai te it ting beh ti lan kok tse tua hi inn liong tiong hian ing ooh
data/valid/1599.wav,i the tshinn gua ai tsiah ioh a
data/valid/1600.wav,be
data/valid/1605.wav,tong lian u su iau pau kuah tui siunn beh oh tai gi e gua kok lang ma pau kuah lan tsit tai kah e tsit tai
data/valid/1607.wav,lim tiunn lo tshut lai tak ke ip le to hun pin tsu tse loh
data/valid/1611.wav,si hai ing tsit bue tsit bue gin sik e hi a sio tsinn beh peh khi lai huann ting
data/valid/1629.wav,ke tse i king tui hiong kang thuann kah kui a tsiu tak ke tioh ai tsu i
data/valid/1651.wav,li beh be hoo siu kuan in sio be a tsiah e tioh m
data/valid/1657.wav,ai io ue koh sin e liooh
data/valid/166.wav,lang leh siunn pan huat ka mng phah khui
data/valid/1675.wav,hun sik ka kong bok tsing huat sing hik tsu tsian tsing e hong hiam
data/valid/1684.wav,gi su tah phue collocation si hak sip gi su an tsuann su iong tsin ho e kang khu
data/valid/1699.wav,tsit e a put lah ooh sit tsai u kau kau bin sin e
data/valid/170.wav,pi lu kong kok tse hing su huat inn
data/valid/1704.wav,a ban a tng khi tsiah hi tsiu
data/valid/1707.wav,hut mng huat su tsia te tsing tsai san khi tshiong tut sim tsi tsham lah sap ue to kong tshut tshui
data/valid/1731.wav,hit e a peh tak pai theh tioh mai ku to m khing pang li ai khah tsu i leh mai hoo i tsiunn tai
data/valid/174.wav,bok tiau tsuan hing tshong sin tsha kiah tshut thau thinn
data/valid/1749.wav,e beh lai se thau ah lah
data/valid/1751.wav,gua tu ho u sun loo bo gua tshua li lai khi honnh
data/valid/1771.wav,ji khong it ji ni tsap ji gueh ti tai tiong
data/valid/1773.wav,gua e kau
data/valid/1775.wav,i siunn beh ainn a ma khi hoo i sing khuann
data/valid/1777.wav,tshiann li ka hun tshuh hoo hua
data/valid/178.wav,tsan sing tsia o lo i kiann bu sit loo suann m koh kiong ho tong ti kok hue ka te tse
data/valid/1782.wav,tse sann e tiam hia thau khak jiau leh jiau leh siunn tsin ku to siunn bo
data/valid/1785.wav,tua tse ke gua bo kui hue
data/valid/1787.wav,tse tshut tshia ho liau au tshia e ban ba uai khi ah
data/valid/1789.wav,tak ke khuann u lang tsiah lak liap long khiong kiann ka ti tsiah su lang ma long kio lak liap lai tsiah
data/valid/1792.wav,tai tsi ai ka mng hoo tshing tshing tsho tsho
data/valid/1800.wav,io ah io ni bu
data/valid/1804.wav,tak gueh tak jit lan it tit it tit ui tioh kang khuan e tai tsi kap kang khuan e lang lai uan ke
data/valid/1807.wav,tshut jit thau a
data/valid/1808.wav,an ne li ing kai koh e ki tsit li si an tsuann hoo lan tai tong liau hiah tse tsinn
